{
  "mdf_version": "1.0",
  "site": "https://example.com",
  "pricing": {
    "default": { "amount": "0.0001", "currency": "USDC", "chain": "base" },
    "sections": {
      "/docs/**": { "amount": "0.0000" },
      "/premium/*": { "amount": "1.0000", "currency": "USDC", "chain": "base" }
    }
  },
  "auth": {
    "endpoint": "https://example.com/mdf/auth",
    "token_ttl_seconds": 86400,
    "price_threshold": "10.00"
  }
}
